{
  "location": "Boston, Massachusetts",
  "display_name": "Boston, Suffolk County, Massachusetts, United States",
  "coordinates": {
    "lat": 42.3588336,
    "lon": -71.0578303
  },
  "current": {
    "temperature": -9.3,
    "wind_speed": 14.5,
    "weathercode": 0,
    "is_day": 0,
    "condition": "Clear sky",
    "emoji": "ðŸŒ™"
  },
  "daily": {
    "temperature_max": -3.3,
    "temperature_min": -11.8,
    "sunrise": "2025-12-05T06:58",
    "sunset": "2025-12-05T16:11",
    "weathercode": 3
  },
  "timezone": "America/New_York",
  "updated_at": "2025-12-05T06:29:13Z"
}
